{
  "schemaVersion": 1,
  "kind": "beats",
  "engine": "argmin-figure",
  "scene": "distribution-points",
  "title": "Acht Punkte, mehrere Zusammenfassungen",
  "caption": "Acht Werte, acht Punkte. Mehrfach vorkommende Werte stehen übereinander.",
  "hint": "Die Lektüre erklärt das Beispiel und seine Grenzen.",
  "params": {
    "binWidth": 2,
    "copies": 1
  },
  "beats": [
    {
      "id": "step-0",
      "caption": "Acht Werte, acht Punkte. Mehrfach vorkommende Werte stehen übereinander."
    },
    {
      "id": "step-1",
      "caption": "Die Punkte werden in Fächern gezählt. Die Fachbreite verändert keine Messung."
    },
    {
      "id": "step-2",
      "caption": "Mit den Kanten 0, 4 und 9 entstehen die Häufigkeiten 1 und 7. Die letzte rechte Kante zählt mit."
    },
    {
      "id": "step-3",
      "caption": "Dieselben acht Punkte liefern Median und Quartile. Der Boxplot fasst ihre Lage zusammen."
    }
  ]
}
