{
  "schemaVersion": 1,
  "kind": "inline",
  "engine": "argmin-figure",
  "scene": "evidence-cards",
  "title": "Vier Felder im Fehlerjournal",
  "caption": "Eine feste Karte trennt Beobachtung, Reproduktion, Ursachenhypothese und nächste Prüfung.",
  "hint": "Die Figur zeigt das feste Lektionsbeispiel.",
  "params": {
    "card": "journal"
  },
  "beats": [
    {
      "id": "step-0",
      "caption": "Die festen Felder machen den dokumentierten Zusammenhang sichtbar."
    }
  ]
}
